{
  "artifact_type": "VerificationResult.v1",
  "check_groups": [
    {
      "checks": [
        {
          "check_id": "process.complete",
          "mandatory": true,
          "status": "passed"
        }
      ],
      "kind": "process"
    },
    {
      "checks": [
        {
          "check_id": "evidence.present",
          "mandatory": true,
          "status": "passed"
        }
      ],
      "kind": "evidence"
    }
  ],
  "claim_ids": [
    "claim.safety.no_egress"
  ],
  "created_at": "2026-07-24T12:05:00Z",
  "decision": "accept",
  "execution_status": "completed",
  "initial_state_digest": "sha256:aaaaaaaaaaaaaaaaaaaaaaaaaaaaaaaaaaaaaaaaaaaaaaaaaaaaaaaaaaaaaaaa",
  "input_bundle_digest": "sha256:cccccccccccccccccccccccccccccccccccccccccccccccccccccccccccccccc",
  "integrity": {
    "artifact_digest": "sha256:7fa5afbf3d931d448c724fb0542101f7c8bc5f14cd19456c3344d3d8d23a0ad2",
    "canonicalization_version": "v1"
  },
  "normalization_applied": true,
  "normalized_result_digest": "sha256:bbbbbbbbbbbbbbbbbbbbbbbbbbbbbbbbbbbbbbbbbbbbbbbbbbbbbbbbbbbbbbbb",
  "producer": "OVK",
  "producer_version": "0.1.0",
  "raw_backend_output_digest": "sha256:aaaaaaaaaaaaaaaaaaaaaaaaaaaaaaaaaaaaaaaaaaaaaaaaaaaaaaaaaaaaaaaa",
  "resource_limits": {
    "memory_bytes": 1048576,
    "wall_time_ms": 1000
  },
  "schema_version": "v1",
  "source_commit": "e068794683959c52a19594a6d271dd5e69f3c999",
  "source_repo": "https://github.com/SentinelOps-CI/pcs-core",
  "terminal_state_digest": "sha256:bbbbbbbbbbbbbbbbbbbbbbbbbbbbbbbbbbbbbbbbbbbbbbbbbbbbbbbbbbbbbbbb",
  "trajectory_digest": "sha256:dddddddddddddddddddddddddddddddddddddddddddddddddddddddddddddddd",
  "verification_result_id": "vr-001",
  "verifier_profile": {
    "profile_digest": "sha256:c515b34f1f61d9b8d139d2a14a92409b2d45ffee16d16bb4c89913db1ebd53b0",
    "verifier_profile_id": "vp-ovk-static-001"
  }
}
