{
  "schema_version": "v1",
  "artifact_type": "VerificationResult.v1",
  "verification_result_id": "vr-opa-demo-001",
  "created_at": "2026-07-24T16:00:05Z",
  "producer": "OVK",
  "producer_version": "0.4.0",
  "source_repo": "https://github.com/SentinelOps-CI/open-verification-kernel",
  "source_commit": "e068794683959c52a19594a6d271dd5e69f3c999",
  "verifier_profile": {
    "verifier_profile_id": "vp-opa-demo-001",
    "profile_digest": "sha256:a4499695423937d2fedb86b5dfd21e65a053cc02c78c38f35e77ce8a98a42a44"
  },
  "claim_ids": [
    "policy.allow"
  ],
  "trajectory_digest": "sha256:bbbbbbbbbbbbbbbbbbbbbbbbbbbbbbbbbbbbbbbbbbbbbbbbbbbbbbbbbbbbbbbb",
  "input_bundle_digest": "sha256:aaaaaaaaaaaaaaaaaaaaaaaaaaaaaaaaaaaaaaaaaaaaaaaaaaaaaaaaaaaaaaaa",
  "raw_backend_output_digest": "sha256:bbbbbbbbbbbbbbbbbbbbbbbbbbbbbbbbbbbbbbbbbbbbbbbbbbbbbbbbbbbbbbbb",
  "normalized_result_digest": "sha256:cccccccccccccccccccccccccccccccccccccccccccccccccccccccccccccccc",
  "normalization_applied": true,
  "normalizer_version": "ovk.normalize.v1",
  "check_groups": [
    {
      "kind": "process",
      "checks": [
        {
          "check_id": "opa-eval-exit",
          "mandatory": true,
          "status": "passed"
        }
      ]
    },
    {
      "kind": "authority",
      "checks": [
        {
          "check_id": "policy-allow",
          "mandatory": true,
          "status": "passed"
        }
      ]
    }
  ],
  "resource_limits": {
    "wall_time_ms": 120,
    "memory_bytes": 67108864
  },
  "execution_status": "completed",
  "decision": "accept",
  "guarantee_class": "runtime_observed",
  "declared_input_guarantee_class": "runtime_observed",
  "invocation_ref": {
    "invocation_id": "vi-opa-demo-001",
    "invocation_digest": "sha256:aaaaaaaaaaaaaaaaaaaaaaaaaaaaaaaaaaaaaaaaaaaaaaaaaaaaaaaaaaaaaaaa"
  },
  "assumptions": [
    {
      "assumption_id": "a-policy-pin",
      "statement": "Policy digest matches profile.configuration.policy_digest",
      "critical": true
    }
  ],
  "limits": [
    {
      "limit_id": "l-no-formal",
      "statement": "OPA eval is observational; not a formal proof."
    }
  ],
  "integrity": {
    "canonicalization_version": "v1",
    "artifact_digest": "sha256:ec7d364835a69ee600857503a15099dd9d07be40bafd4ea8248fdd2d01fd7ac2"
  }
}
